review_user,review_rate,review_time,review_text
Ly H,3 stars,2 days ago,"Do not take the northern route coming from ""Bangkulotan Hillside"" as there is 2km of hard off road. It is a small path in the forest too difficult for scooters (impossible for cars) because of large stones and mud on the way up.
The road  …"
Karl Heinz,1 star,2 days ago,"Exhausting journey, but good variety to stretch your legs

Why are people whining because of the small amount of money that is being asked for.
The …"
mark herediano,5 stars,3 weeks ago,N/A
Emeric Magny,5 stars,3 weeks ago,"Incredible place, you have to take a guide we paid 220 pesos for two (parking included)!

PS: To  …"
ted thor,5 stars,3 weeks ago,"Definitely my favorite place of all other places that I have visited while I am in Cebu. The 1-hr motorcycle ride was such an adventure. The gusty, chilly mountain wind is a very nice change to the warm coastal breeze. Definitely a must see & a must do."
Totskie TV,5 stars,a month ago,nice place
Gilbert Coronado,5 stars,a month ago,N/A
Khirlstine Lhou Garcia,5 stars,a month ago,"Great experience ❤️ Nice view, fresh air and feels like little tagaytay co'z it's cold😌 Best place to hike, worth the wait til to the top❤️🌄 …"
Jo Sutia,5 stars,2 months ago,"A must go place. But be prepared for the entrance, environmental and tour guide fees."
Robert Lüthgens,5 stars,2 months ago,Camping is a great way to have fun even when the weather was bad. We all had a lot of fun
Ana Liu,4 stars,2 months ago,"First, this is not a ""hike"".  It's a ""ride"" to the tourist center with a paid entrance fee (50 pesos) and a mandatory guide fee (100 pesos) to access the small hiking trail to the vista point where you can see some nice views of Moalboal …"
Teddy See,1 star,2 months ago,"Would give 0 stars if I could.

Came up here thinking it was just a hike up to the peak for a sunrise view. Was …"
Christian Paolo Macatangay,5 stars,2 months ago,N/A
Maxime Baucheron,5 stars,3 months ago,"Incredible place, unfortunately you have to take a guide, really incomprehensible this is not a trek but a short 10 min walk, but hey that's how it works at every tourist spot in the Philippines,
Be careful to go there when there is not too much cloud, otherwise you will not see anything…"
Verna B,4 stars,3 months ago,Good to visit this campsite in summer or there is no rain so the night moment at the peak is nice.. The view is beautiful and worth it eve …
Vienna Lee,5 stars,3 months ago,N/A
Agdoron Gemaildotcom,5 stars,3 months ago,"15min trek to peak from tourism office.

Very friendly and helpful guides …"
MIHWA HER,5 stars,4 months ago,"I visited it because it was not too far away, taking about 30 minutes to go to Simala Cathedral, but it was really …"
Radek Šinc,5 stars,4 months ago,A beautiful journey on a motorcycle and nice views …
Minsu Ham,1 star,4 months ago,"100 pesos for tour guide lol
I thought I was supposed to explore the top of the mountain, Himalaya.
All I could hear from the guide was that ""it is the point, it is beautiful"" …"
Heero Villegas,1 star,4 months ago,"Not the actual location of the Place. It is on the other side wich is exact location.
please dit location so that no one will mislead while going there."
Bruno Cooke,5 stars,4 months ago,"Osmeña Peak is a spectacular place to camp - and if you do, you'll get to see the surrounding highlands all the way down to Moalboal and a large stretch of the western coast of Cebu at sunset AND sunrise. …"
DominiQC Asean,5 stars,5 months ago,Follow directions on the road rather than Google map directions. You'll have to turn right rather than go straight when about 500m away from your destination. …
Agnieszka Brachucy,4 stars,6 months ago,"We paid 50 PHP for entry. We had to pay mandatory 100 PHP for the guide, cheating! The guide just walks, the terrain is very simple. It took us 15 minutes to get in."
hei_journey,5 stars,6 months ago,"Beautiful view point. Similar to the Chocolate Hills in Bohol, only much more beautiful and impressive.
The journey from Moalboal is adventurous. Definitely arrive via Alegria. The faster ro …"
Laura Birks,3 stars,7 months ago,"If you hike to nice places a lot, then this really isn't that special. It's a nice view but there were too many people when we went to fully enjoy it. Having a mandatory guide makes me feel uncomfortable and rushed. Why they are mandatory …"
Jaro Tan,5 stars,7 months ago,Great view. Breathtaking experience.
Dash Venus,5 stars,7 months ago,View is amazing! Fun experience!
Glenn Paulo Dudas,5 stars,7 months ago,Scenic view has a city light view of Cebu City
francis estrella,5 stars,7 months ago,a fantastic hiking experience!! perfect place to unwind with outstanding view
CARMINA JOY ALSON,5 stars,7 months ago,N/A
Mae Ann Aguinaldo,5 stars,7 months ago,Very promising place🥰 …
Maria margallo,5 stars,7 months ago,Amazing experience! Incredible hiking yet so enjoy!
Reinier Magtoto,5 stars,7 months ago,One of the finest! Grateful to be visiting this extravagant place! Best places to stay for a wonderful view!
Ingco Sta Cruz Concept Store,5 stars,7 months ago,A fantastic hiking experience!!! I highly recommend
Sarah Grace Deladia,5 stars,7 months ago,Great experience!
Jezer john Dogoldogol,5 stars,7 months ago,an amazing hiking and picture taking experience. It was breathtaking view 🤩🤩🤩 …
Barachiel Concepcion,5 stars,7 months ago,Nice view!
Lynn Lopez,5 stars,7 months ago,N/A
Regilyn Salazar,5 stars,7 months ago,nice view. reccomendable for hiking.
Norie Anne Olais,5 stars,7 months ago,"I love to hike, and this place is perfect, foggy until dawn, best experience to be here"
Settie Naisah Cassan,5 stars,7 months ago,The best view to unwind ❤️ this is the perfect place to relax! ❤️💖 …
Jam`Z zxc,5 stars,7 months ago,"Osmeña peak one of the best choices you can consider if you're gonna stay cebu. The rooms are well-maintained by the house keepers, the food is great, and remarkably the pool is awesome."
Gary Nicolas,5 stars,7 months ago,Nice location
"REYES, REYNALYN B.",5 stars,7 months ago,Amazing
Ry Anamong,5 stars,7 months ago,The hiking was definitely worth it!
reg javier,5 stars,7 months ago,N/A
Khrystian King Moldez,5 stars,7 months ago,Stunning view
Pauline Luz Saique,5 stars,7 months ago,N/A
Maelyn Ungriano,5 stars,7 months ago,"fantastic view up this peak, everyone should really try going here. totally worth it."
Milchen Añasco,5 stars,7 months ago,Relaxing and so beautiful place.❤️❤️
福建师范大学,5 stars,7 months ago,Cold weather and a peak beautiful view here in Osmeña Peak is amazing! We’ll be back again for a refreshing environment ❤️
Joanne Laguda,5 stars,7 months ago,This is a nice place to unwind especially if you want to run away from stressed from work and take adventure to hike here. I will recommend this place to my friends and will go back here again.
Beverly Jorolan,5 stars,7 months ago,Awesom hiking experience!
Joanna Camille Espayos,5 stars,7 months ago,A fantastic hiking experience!! I hope to visit soon.
Chloe kyla Sarmiento,5 stars,7 months ago,N/A
TrixiaMay Belga,5 stars,7 months ago,Awesome hiking experience
Nina,5 stars,7 months ago,It was an amazing hiking and picture taking experience. It was breathtaking view
Gracelle Rivera,5 stars,7 months ago,So relax place perfect for hiking and nature sceneries😍 …
EJ Blanca,5 stars,7 months ago,One of the most famous peak noted as one of the highest on Cebu. It is a very tricky hike but I guarantee that this experience is a very good one!
Jennsanc Canoy,5 stars,7 months ago,"What an awesome experience to conquer the famous highest peak of Southern Cebu, the Osmena Peak. Cold breeze of the day and exciting panoramic view certainly welcome every visitors that seeks to unwind and unload stresses."
Charisse Mae Condino,5 stars,7 months ago,I went to this wonderplace last year with friends. I cant wait to go here again hopefully next year 2023!!!!
emmanuel pulido,5 stars,7 months ago,The best way to unwind and to be with nature! The view from the top is breathtaking. I will surely come back here.
Laarni Janer,5 stars,7 months ago,"A fantastic hiking experience!!! I highly recommend you have a guide and get a walking stick. It took us about half an hour to walk up to the peak with our guide helping us trek up (a bit slippery because of the slight rain) and to take photos along the way. On the way down, we bought freshly harvested sayote ⛰🌼🍃 …"
Elle Adrias,5 stars,7 months ago,Super relaxing and fantastic view
Ronald Catubao,5 stars,7 months ago,Best place for nature lovers.
Joseph Niel Mirasol,5 stars,7 months ago,"My hiking experience was so great in Osmeña Peak, I will surely go back again."
Deanne Mallari,5 stars,7 months ago,"Awesome place, i highly recommend this who loves hiking. It's safe!"
Jojemae Jayme,5 stars,7 months ago,The best view comes after the hardest climb. ♥️
Fredgie Mae Monacillo,5 stars,7 months ago,Perfect for a serene and relaxing getaway with friends and family. 💕 …
jonabelle afrondoza,5 stars,7 months ago,GOOD CHOICE
Michael Carbonel,5 stars,7 months ago,N/A
Keith Nicole Faderogao,5 stars,7 months ago,A good and fun hiking experience here! Highly recommend!
Catherine Rose Pabustan,5 stars,7 months ago,I really love the place! Such entertaining guides will lead you to the destination. Would really love to go back here!!
Micha Cabrera,5 stars,7 months ago,This place is breath-taking
Ehron Dumrigue,5 stars,7 months ago,Nice for camping and better view this place is very cold
Engineer ME,5 stars,7 months ago,"Nice place, good for hiking, nature friendly, fresh air"
Nor-Ain Gautan,5 stars,7 months ago,N/A
Brix Lorcha,5 stars,7 months ago,N/A
Mi Cah,5 stars,7 months ago,Great place with good people!
Ryan Famisaran,5 stars,7 months ago,Proper attire is a must when hiking in this place. A great scenery awaits you.
Lourimyr Denoso,5 stars,7 months ago,"The beauty of nature, awesome"
Ronalyn Dela Pena,5 stars,7 months ago,Great experience! Recommended for those who want to hike and release all their stress and shout put loud in the the top of the mountain. It is safe and has a great view. Love it! 😍❤️❤️ …
Mika Marte,5 stars,7 months ago,Recommended for those who likes adventures. A good place for hiking!
Julie Ann Subosa,5 stars,7 months ago,"if you love hiking, this is the best place. best getaway for summer vacation. my friends and I enjoyed our stay and so awesome to feel nature!"
richelle bartolome,5 stars,7 months ago,Awesome hiking experience. Highly recommended for adventurous people like. 😀😀😀😀 …
Jessa Mae Molles,5 stars,7 months ago,"I highly recommend this place, the view and place is very nice it will give you peace of mind."
Jam,5 stars,7 months ago,Very Nice place! Fantasic view. Good place to unwind.
Pauline Bongon,5 stars,7 months ago,This place is amazing. If you are planning to go to Cebu this place is a must.
cherry Jorolan,5 stars,7 months ago,Highly recommended! You have a guide to keep yiu safe and enjoy the place!
Lyka Chelly Reyes,5 stars,7 months ago,This place is perfect for those who love adventures and hiking. The view is very relaxing. Perfect for a group bond or those who wants to unwind.
Christine Deapera,5 stars,7 months ago,N/A
Mariel Jane Bunglay,5 stars,7 months ago,"Bring your partner, you will actually have a momentous get along. The place is warmth and unique. Capture each moments with absolute view😊 …"
Jayson Gomez,5 stars,7 months ago,The peak mountain range is soo beautiful and i have a great experience reaching the summit. Have a great guide that help us and motivate us to summit. We will visit again
Jeffrey Aboga-a,5 stars,7 months ago,"Nice is so very beautiful , highly recommend ♥️🤩 …"
Ruby-Ann Latras,5 stars,7 months ago,N/A
JAY ROOF'S MotoVlogzzz,5 stars,7 months ago,N/A
Victor Santiago,5 stars,7 months ago,Great place. Nice view. Perfect for hiking
kristel anne locsin,5 stars,7 months ago,N/A
Scarlet Diane,5 stars,7 months ago,Perfect place to visit . Such a relaxing place
Angela Loren Gonzales,5 stars,8 months ago,I'm fond of hiking and I recommend this to put into your list of things to do in Cebu especially if you're an adventure seeker. The scenery at the peak is breathtaking! Just remember to go there around summer season so you will have a fog-less view of Cebu.
Robinette Sedon,5 stars,8 months ago,A very fantastic view! If you want to unwind this is a place for you. The place is very cold and instagrammable ❤️
Ruffa Mae Ambat,5 stars,8 months ago,Highly Recommended Place.
Guadamae Suarez,5 stars,8 months ago,"Highly amazing view from above. It helps me to be active on my fitness journey. Highly reccommend this to hike in the mountains, great views of the surroundings and cool air. One could also go with mountain bikes with friends. Great view with fresh air."
lyramie go,5 stars,8 months ago,Nice view!
Abegail Aril,5 stars,8 months ago,"I love to hike, and this place is perfect, foggy until dawn, best experience to be here"
Jeanne Kaitlin Villanes,5 stars,8 months ago,I had an awesome hiking experience with cold breeze
Yassy Tullao,5 stars,8 months ago,"If you're looking to escape from the hustle and bustle of everyday life, or if you want to get a taste of adventure, then here is Osmena Peak is the place for you. 💯 …"
Khyle Emelene Ardaniel,5 stars,8 months ago,N/A
Aura Alyssa Pineda,5 stars,8 months ago,N/A
Rhearica Lugtu,5 stars,8 months ago,Ok
KyledeeGaming,5 stars,8 months ago,Nice view & good environment love it
angelica tolentino,5 stars,8 months ago,N/A
Eloisa Gabaldon,5 stars,8 months ago,Such a breath taking view! Will definitely go back here! The scenery is very relaxing. Budget friendly 🤩 …
Leanne Mae Millare,5 stars,8 months ago,N/A
chrisean bimbao,5 stars,8 months ago,Great place to unwind!
Carlo G.,5 stars,8 months ago,Very good for trekking and fresh air.
Jenny Cuadera,5 stars,8 months ago,Nice place
Princess Louiela Lipata,5 stars,8 months ago,The place was amazing
Ella Quizon,5 stars,8 months ago,"A perfect place to unwind, this is highly recommended if you want a hiking experience! don't forget to wear a proper attire and have fun! ❤️"
Maribel Boongaling,5 stars,8 months ago,Highly recommended.
Kristian Dagalea,5 stars,8 months ago,Tired but worth it you must try!!!!
Nicole Granados,5 stars,8 months ago,Great view!
JOHN PATRICK PAGUINTO,5 stars,8 months ago,For nature lover.
Rhica Macabansag,5 stars,8 months ago,The Place is so nice and clean.
Antonette Carpio,5 stars,8 months ago,Very accommodating and satisfying. You can enjoy the view plus the staffs are very friendly and welcoming. Very clean and well sanitized room.
Donnatila Abadilla,5 stars,8 months ago,nice!
Waygne Paule,5 stars,8 months ago,N/A
Prince Ronnel Salazar,5 stars,8 months ago,N/A
Sarah Jane Cadiz,5 stars,8 months ago,It's always an amazing experience to got here.
Gerby Ritual,5 stars,8 months ago,N/A
John Joseph Benares (seedsop),5 stars,8 months ago,"fantastic view up this peak, everyone should really try going here. totally worth it."
Audric Efraim Anastacio,5 stars,8 months ago,"Once you go to Cebu, this place is definetly a must! I've been living in Cebu for over 5 years now and this place never cease to fail me! If you want some adventure and hikings, come visit here!!"
Aj Pearl Bathan,5 stars,8 months ago,It's so nice here because the air is very fresh and this place is so very beautiful ❤️
Ez Piolo,5 stars,8 months ago,"Had a fantastic time visiting here the hiking experience was the best and the view is marvelous, visiting again soon."
Nenita Azures,5 stars,8 months ago,A beautiful scenery 😍😍😍 Refreshing …
Jeffrey Del Rosario,5 stars,8 months ago,The challenges are worth it when you reach the peak. Great experience 😍😊👍🙂 …
Bernadeth Yap. Basco,5 stars,8 months ago,🥰🥰🥰 …
Patricio Flores,5 stars,8 months ago,such a nice place
Mark Gerald Punu,5 stars,8 months ago,nice scenic view!
Queenei Mondares,5 stars,8 months ago,N/A
nazka traci tigoylo,5 stars,8 months ago,"I can still remember when I first visited here, it was my birthday. Such a wondeful gift to be there. I really love it as a nature lover. We just walk along under the heat of the sun. So nice!"
camille susanne,4 stars,8 months ago,The view is fantastic
Leyz Leyn,5 stars,8 months ago,"A fantastic hiking experience!!! I highly recommend you have a guide and get a walking stick. It took us about half an hour to walk up to the peak with our guide helping us trek up (a bit slippery because of the slight rain) and to take photos along the way. On the way down, we bought freshly harvested sayote"
Karen Sua,5 stars,8 months ago,Beautiful place and one of my favorite spots in Cebu!❤️
Aime Quillano,5 stars,8 months ago,It's Absolutely amazing
Giselle Placios,5 stars,8 months ago,"Mesmerizing view ,I like it"
ZeveAvenido,5 stars,8 months ago,my experience was amazing and i like the place. My gf brought me here to experience some minor hikings.
Iya,5 stars,8 months ago,"A perfect place to unwind, this is highly recommended if you want a hiking experience! don't forget to wear a proper attire and have fun!"
Poy Labartinos,5 stars,8 months ago,Great place to relax and unwind. Highly recommendable.
Wesley,5 stars,8 months ago,The hike is like a short walk. Awesome view!
No One,5 stars,8 months ago,Highly recommend this palace
HazelGift ArancisKun,5 stars,8 months ago,N/A
Mark Joseph Payopay,5 stars,8 months ago,N/A
jigs angeles,5 stars,8 months ago,wow😲😲 this place is awsome.. You will enjoy the green nature. it is really relaxing …
Batgirl Sparkle,5 stars,8 months ago,Fantastic view! Will come back for sure!
Charina Oraa,5 stars,8 months ago,Amzing view with amazing people. This is a must try location. 5 stars for this amazing place
Ferwin Yolangco,5 stars,8 months ago,N/A
John Earl Carandang,5 stars,8 months ago,What a good place to visit. a relaxing place to visit
Rizalyn Ann Amable,5 stars,8 months ago,.. the view here is perfect for pre-nup.. ideal place to hike with friends and love ones.
Shiera,5 stars,8 months ago,N/A
Ferwin Yolangco,5 stars,8 months ago,N/A
Ruth Marie Abril,5 stars,8 months ago,"Very recommend to hike😍
Nice view😍 …"
Jaymark Gabison,5 stars,8 months ago,Nice place
DM DC,5 stars,8 months ago,This place was awesome. Very relaxing view and nice place to hike and hang out. We will surely revisit this place again ☺️😍 …
Rod Cad,5 stars,8 months ago,Very good service
Albert Servan,5 stars,8 months ago,A wonderful place to go.
Princess Marlaine Picache,5 stars,8 months ago,perfect for picture taking
Julius Dangca,5 stars,8 months ago,N/A
Kevz Villa,5 stars,8 months ago,"This place is great, highly recommended"
Mark Chester Ona,5 stars,8 months ago,love the view
Jaey Marlowe Catabian,5 stars,8 months ago,N/A
Stephanie Rebaca,5 stars,9 months ago,N/A
Edgar Flin,1 star,10 months ago,This is not the location
Marlou Nuevo,5 stars,10 months ago,Super cold during our camping experience and we love it.
Jo Phillip Lungay,5 stars,10 months ago,N/A
T WG,5 stars,10 months ago,"Easy 20min trek, with a guide. Beautiful scenery. Went in May 2022."
queen verly,5 stars,11 months ago,N/A
Borja Unceta,4 stars,a year ago,The hike is more like a short walk. There is NO need to get a guide even if they claim that is compulsory. This is simply not true and a bit ridiculous considering the distance and the difficulty.
Iris,3 stars,a year ago,"We were really excited to go visit the peak, however you cannot really reach the peak by yourself on a motor bike unless you’re a really advanced driver. Dirt roads were way too bad from Moalboal to the peak. Perhaps from the east side of the island, roads are better. Get a tour and a guide to the peak, I think."
Jeremias,5 stars,a year ago,N/A
Michael Robert Balatayo,5 stars,a year ago,"The journey to the peak is an additional exciting trip. If you know, you know."
Romeo Taguiam,4 stars,a year ago,"The trail is just easy, awesome scenery at the peak."
Alfonso Garcia,5 stars,a year ago,"A fantastic hiking experience!!! I highly recommend you have a guide and get a walking stick. It took us about half an hour to walk up to the peak with our guide helping us trek up (a bit slippery because of the slight rain) and to take photos along the way. On the way down, we bought freshly harvested sayote ⛰🌼🍃 …"
Irene Sanoy,5 stars,a year ago,Super worth the trek and climb! The view is so refreshing and magnificent!
agusto “Jun/augost” channel official,5 stars,a year ago,N/A
Kitty Ü,5 stars,a year ago,"my experience was amazing and i like the place. My bf brought me here to experience some minor hikings.
Beautiful view. We hired a guide to take us some pics. l …"
Nestor PRECIOSO,5 stars,a year ago,"Great views, with Moalboal and Badian, though you will have to time it such that the clouds/fog will not obstruct the view. As of Nov 2021, the entrance/environmental fee is 50 pesos per pax. A local guide in reaching the peak is mandatory, …"
ESTEBAN Lelis,5 stars,a year ago,"Nice place,,
It's far away from sd a …"
Jerome A,4 stars,2 years ago,N/A
Aldrin Luzares,5 stars,2 years ago,N/A
Virgilio Superable,5 stars,2 years ago,Amazing
Deeyosha,5 stars,2 years ago,🌸 As what everybody says: The view here is really nice and breathtaking. There is no doubt. …
Lois Natalie Ordiz,4 stars,2 years ago,If you want to get that quick change of scenery from up above with just a few minute hike — that I’m sure anyone can tolerate. This is it! 😉 Better to go there early in the morning! You’ll also get a tour guide who can take your pictures …
Miraflor Rustia,5 stars,2 years ago,Just go there and seize the nature and it's beauty ❤
John Hile,5 stars,2 years ago,"The place is very accessible to motorcycles and by car, the hiking time would be running about 20-30 minutes walk and is also an easy way for trekking. The place is absolutely beautiful and amazing landscape with cold weather on top of it, …"
Aja Aboyme,5 stars,2 years ago,Easy trail with amazing view!
Purushoth Kavi,5 stars,2 years ago,N/A
Linda Mahawan,5 stars,2 years ago,Is it very Wonderful  view point and very clean air from Osmena peak
RJ,5 stars,2 years ago,You should go there around 11 am above. If tou go there 8am below theres a chance it's really foggy and you cant enjoy the view.
Grant Asilom,5 stars,3 years ago,"Definitely worth the effort. The view is just one of a kind, and the temperature at the peak is colder. You can also buy their fresh produce on your way home."
Mark Jason Oñada,5 stars,3 years ago,Osmeña Peak is most famous for being the highest point on Cebu island and it’s one of the best adventures to be had in the South Cebu region in the Philippines! …
Gladson M. Robin,5 stars,3 years ago,What a lovely place to relax from the top of the mountains!!! So peaceful and calm.... We can do camping here too... The view is so great... There are also shops in between as we walk from the parking spot to the peak for a period of 30 …
Riena Cabial,4 stars,3 years ago,"Easy trail, we did not plan to hike this place so we only wore slippers but it's manageable . If you want to witness the sea of clouds ,you should be early. The view up is worth the trek."
L J,5 stars,3 years ago,"Great views of Cebu from the top. Best to visit on a clear day too see further! Well worth the long drive!
The short walk from the drop off point can be a bit sloppy when wet. At the …"
jack ryan,5 stars,3 years ago,"A long drive, but definitely worth it once you reach the top"
Jane Claire Escala,4 stars,3 years ago,"Accessible - You can ride buses and motorcycle to go to the area.

There is an entrance/environmental fee of Php30.00 per person. I do not know …"
Misc & Extras,5 stars,3 years ago,Scenic view for mountain lover. Out of the world mountain formation and landscape.
Abdul Hadi Mohammed,5 stars,3 years ago,N/A
Willi Adrian Philipp,5 stars,3 years ago,"Want some fresh air and a beautiful place to visit, you have to visit Osmeña Peak, southern Cebu."
Gelvir Onlos,5 stars,3 years ago,Wow! Very nice.
Natasha Styles,5 stars,3 years ago,Osmena peak is cool but make sure you also do Casino (Lugsangan) peak next door. I had a great guide - Anne.
Kristine Deleon,4 stars,3 years ago,N/A
Lonie Ramos,4 stars,3 years ago,N/A
MD Paraiso,4 stars,3 years ago,"Welcome to the highest peak in the province of cebu! 😎

#travelphotography #gwapongpinoys🇵🇭
#cebuphilippines #collectingmemories …"
Douglas Kawahigashi,5 stars,3 years ago,N/A
Kenneth Viola,5 stars,3 years ago,The trail was fairly easy that even a couch potato like me was able to traverse it and reach the summit. I say it's easy but it still took a considerable amount of effort. …
Roland Bautista,5 stars,4 years ago,"-One of the Best Mountain trekking here in Cebu!
-Good Locals
-Afforadable Transportation Price
-Clean Atmosphere"
vivian cagoyong,4 stars,4 years ago,A 15 to 20 minutes hike to the peak.
Christopher De La Rama,5 stars,4 years ago,Nature at its best. Easy trail with commute options. Large camping grounds with friendly locals. Security is kept by the LGU. Good for leisure hikers and mountaineers.
Eusebio “Euse” Pason,5 stars,4 years ago,"The place is awesome. A high altitude for those who is adventurous enough who dare to climb with the risk of falling. The 360 view is fantastic. You come with friends, lover or family. You can also stay a night or two in a designated area …"
Cherry On The World - Travel blog,5 stars,4 years ago,N/A
Vanishing Kaizer,5 stars,4 years ago,20 mins climb to reach the peak. Anyone can climb this peak even if you're not a hiker. The local recommend it to climb for sunset viewing as its always foggy in the morning.
