review_user,review_rate,review_time,review_text
Avil Mascarenhas,5 stars,4 years ago,"Beautiful sunset place

You can go there on your own. Check the distance to this place from your …"
Maxine Chantus,4 stars,4 years ago,"The trek was a good escape from a hustle bustle city life, a good refuge for nature lovers. It's all green and refreshing. It was a sight to behold!"
Niing Niing,5 stars,4 years ago,Allow at least 30min treking up the peak for sunset! The view is 360’ and can be a bit cold up here or riding scooter back at night. Little boys may offer to be your local guide saying there are so many pathway to go up the peak (which is …
Cowell Chan,4 stars,4 years ago,A bit of trekking needed to reach the top. Views are amazing. No need to get a guide as there is footpath to follow. Otherwise you'll need to pay for the guide which we didnt know at the time.
Ms. Ebeb,5 stars,4 years ago,"been here for 3 times already ,, happy climbing !!"
Junerey A. Mills,5 stars,4 years ago,The place is perfect of nature relaxation. Me and my friends have a lot of fun hiking the trail.
nasrullah au,4 stars,4 years ago,"Why five stars? It is because its unique panoramic view of summits of hills that can be reach in easy way even for non hikers/outdoors person. The last time i was there on 2015. No entrance fee, habal-habal (motorcycle taxi) are available. For runners, you can run from nearest market to the top."
KM Manalastas (Kring),5 stars,4 years ago,N/A
fritz amores,5 stars,4 years ago,N/A
Panachai Korsawatworakun,5 stars,4 years ago,Nice view
Martin Kotyk,4 stars,4 years ago,"Nice view. We rented motorbikes in Moalboal and drove here. There are two roads leading here from Moalboal, I recommend taking the longer one that goes around the mountains. We tried both here, we went around the mountains on the way there, we drove over the mountains on the way back... If someone has a borrowed enduro, they probably …"
Jannik Munch Wagner,4 stars,4 years ago,"Nice view from the top. The hike is only 15-20 minutes long, if you take a bike or car to the end of the road at the top.
If you do chose to ride a bike, make sure you are comfortable riding a bike in …"
World of Mohin,4 stars,4 years ago,Spectacular is the word to describe.
Nico Samneil Salado,5 stars,4 years ago,Love the view. Great in early morning or late afternoon as long as it is not cloudy
Jobet Romar Gentallan,3 stars,4 years ago,"If you're going for a day tour only, you don't have to go full mountaineer gaming with your get up. A pair of good old training shoes will do, and warmer clothes if you're very sensitive to the cold. The hike to the peak from the …"
Arneil Paul Polican (Har),5 stars,4 years ago,N/A
Sandz Salea,4 stars,4 years ago,"Nature trekking for all ages. Breath taking view and a best place for barkada bonding. Friendly Trek guides.
A good place to escape from city busy life."
RICHIE RYAN C. MABUNAY,3 stars,4 years ago,"The place is cool and windy, a high place not recommended for children. Extra careful is a must."
John ruffy Santarita,5 stars,4 years ago,N/A
Jappeth Ben Tagud,5 stars,4 years ago,"Majestic place!
Breathtaking view!"
CHAY TV1,4 stars,5 years ago,"Amazing hills , love to climb here. Please visit it's very Worth it even it's hard to get there."
Elesar Cabugnason,5 stars,5 years ago,N/A
NITESH BARAL,5 stars,5 years ago,N/A
davie,5 stars,5 years ago,Fantastic view.. You will need to be fit. Lol
wilm zee,4 stars,5 years ago,"Arriving in the Highway of Dalaguet you can grab a motorcycle ""habalhabal"" as low as 100 pesos per person when going up and 100 going down. It will take atleast 20-30mins before arriving at the foot. And then arriving at the foot you can …"
Remi Popa,5 stars,5 years ago,Little Baguio in Cebu!!!
Jean Figues,4 stars,5 years ago,N/A
Zuriel Alag,5 stars,5 years ago,N/A
Isial Apostol,5 stars,5 years ago,"We walk for 3 hours from Alawijao, Badian up to the peak.It takes an effort to walk that far but the experience is awesome.Worth it!"
ely caracas,5 stars,5 years ago,It was a long journey from Cebu City going to Osmeña Peak. But it's worth it! It was an easy trail. And the view at the peak is awesome! We visited the place during weekdays and there were only few people. Expect crowd during weekends.
Marloe Uy,4 stars,5 years ago,N/A
Laarni Villasanta,5 stars,5 years ago,N/A
Riel Bustamante,4 stars,5 years ago,N/A
Pauline Ann Quiton (Pauee),5 stars,5 years ago,N/A
seon Kim (paru2x),5 stars,5 years ago,N/A
MJadventure Vlogs,5 stars,5 years ago,Nice view!
Mariit,5 stars,5 years ago,Too good
Sherwin Felicidario,4 stars,5 years ago,This is an easy climb. Children 7 and up may climb. Trail is available.
George Glenn Dayada,5 stars,5 years ago,"Perfect choice after canyoneering, conquering Osmeña Peak will totally sum up your Cebu adventure somehow.
...perfect place for the model, photographer and the photo bomber!"
Christopher Patentes,5 stars,5 years ago,Love it...its a historical mountain view...
Gladysh Quinagon,5 stars,5 years ago,"We came from Kawasan falls and rode a habal-habal for Php 500.00 per person. You'll understand why it cost much when you see the distance between these places.
Worth the walk. …"
Franz,5 stars,5 years ago,Very beautiful! We camped here
Koy descartin,3 stars,5 years ago,N/A
李思儀,5 stars,5 years ago,Nice view
Hazel “Zel” Cerio,5 stars,5 years ago,Good for holiday adventure.
Romil Caridad,4 stars,5 years ago,Great for catching a little adventure and photography. Great imagery when facing the coastal area beyond over sunset...:)
Paul Schutze,5 stars,5 years ago,Amazing views! Such a great spot to go to
Rizalino Tunacao,4 stars,5 years ago,It just like chocolate hills in bohol.
marvi bufe,4 stars,5 years ago,N/A
Gladys Amaba (gladventures),5 stars,5 years ago,A good trek for beginners. Nice view at the peak.
Joe Dirt,5 stars,6 years ago,N/A
Dimple Perales,5 stars,6 years ago,The view and the cool air are the best :) But sad to say there is no toilet :)
Romnick Montejo,5 stars,6 years ago,Its so nice..amazing place
iCar Cebu Transport Services,5 stars,6 years ago,N/A
